{
  "event_id": "event_resync_001",
  "event_type": "stream.resync_required",
  "event_version": 1,
  "occurred_at": "2026-07-23T10:08:00Z",
  "practice_session_id": "session_demo_001",
  "correlation_id": "corr_stream_resume_001",
  "replayable": false,
  "payload": {
    "last_available_sequence": 18
  }
}
