{
  "event_id": "event_turn_completed_001",
  "event_type": "turn.completed",
  "event_version": 1,
  "occurred_at": "2026-07-23T10:05:02Z",
  "practice_session_id": "session_demo_001",
  "sequence": 4,
  "correlation_id": "corr_turn_001",
  "causation_id": "event_turn_processing_001",
  "replayable": true,
  "payload": {
    "turn_id": "turn_demo_001",
    "question_id": "question_demo_001",
    "respondent_participant_id": "participant_candidate_001",
    "turn_status": "completed",
    "completed_at": "2026-07-23T10:05:02Z"
  }
}
